{"blocking_reason_codes":["provider_policy_unaccepted","tariff_current_review_pending","gate_b_authorization_pending","runtime_image_pending","source_archive_pending","deployment_config_pending","runtime_identity_pending","authorization_window_pending","owners_pending","credential_handoff_pending","kill_switch_pending","diagnostic_human_approval_missing","headline_human_approval_missing","auth004_nonoverlap_metadata_pending"],"canary_allowed":false,"candidate_artifact_hashes":{"authorization_sha256":"dc988c4a0c338031357661d0946f0235db13980009aa657591b06aa1467826e0","budget_proposal_sha256":"310abbe35e02528b425741023308696c8c8aabe74909fcd4ade3209e6a0b4247","cohort_manifest_sha256":"ddcbc3d16c57cbc9c02268bccb01eee223f3aa3f502cdfa7e449e8171a759e1a","executable_source_sha256":"06a3172519038f84b1c2a4629a2bcabf9f1714404c4fef66bb40d3c625f334b3","runtime_config_sha256":"921e87d89b7d4cde206228f8eab0fc755af871aec40ac39f5c1852e12e92b0c2","sdk_package_set_sha256":"6046ba97a395f5e0ab00799eeecdeafbd466b9fc821821202535571dbae3170f","tariff_manifest_sha256":"fe56c25a178c599ab6a8cebc44727c3353d728c1af5c92fb18abb1b11e28239f"},"checks":{"auth004_nonoverlap_confirmed":false,"authorization_window_valid":false,"baseline_ci_match":true,"baseline_master_match":true,"budget_reservation_restart_validated":true,"candidate_artifact_hashes_consistent":true,"concurrency_one":true,"credential_file_security_confirmed":false,"endpoint_tls_policy_frozen":true,"every_fixture_has_stable_pipeline_stage":true,"final_gate_b_bindings_complete":false,"kill_switch_available":false,"mixed_provider_pipeline_failure_code_absent":true,"offline_compatibility_matrix_passed":true,"phase11b_acceptance_report_match":true,"provider_policy_accepted":false,"publisher_fake_dry_run":true,"raw_content_retention_denied":true,"redaction_applied":true,"redirect_denied":true,"safe_telemetry_complete":true,"sdk_retries_zero":true,"terminal_statuses_split":true,"transport_retries_zero":true},"execution_status":"not_run","phase_id":"phase11c-provider-canary-v1","preflight_verdict_sha256":"0c66fbb6f1a4582a4e0ee8e01a334ad75c65e032d4fbd301f61f2f0ac977a385","protocol_canary_status":"not_run","real_run_recommended_now":false,"redaction_applied":true,"schema_version":"phase11c-provider-canary-preflight/v1"}
